headlines,text
Collins banned in landmark case,"Sprinter Michelle Collins has received an eight-year ban for doping offences after a hearing at the North American Court of Arbitration for Sport (CAS).""The USADA has proved, beyond a reasonable doubt, that Collins took EPO, the testosterone/epitestosterone cream and THG,"" said a CAS statement.Collins' ban is a result of her connection to the federal inquiry into the Balco doping scandal.USADA chief executive officer Terry Madden said the action taken against Collins was further proof of that.The USADA has built its cases on verbal evidence given to the federal investigation into Balco rather than test results.So far a total of 13 athletes have been sanctioned for violations involving drugs associated with the Balco doping scandal.The US Anti-Doping Agency (USADA) decided to press charges against Collins in the summer"
Jones doping probe begins,"Jones, who says she is innocent, could lose all her Olympic medals after Conte said he gave her performance-enhancing drugs before the Sydney Olympics.The Sydney Olympics ended more than four years ago, but World Anti-Doping Agency chief Dick Pound said the rule may not apply because the allegations are only coming out now.An investigation into doping claims against Marion Jones has been opened by the International Olympic Committee.""Victor Conte's allegations are not true and the truth will be revealed for the world to see as the legal process moves forward,"" she said"
Johnson accuses British sprinters,"Their focus has to be on being the best in the world and not just on being the top British sprinter.""Former Olympic champion Michael Johnson has accused Britain's top sprinters of lacking pride and ambition.""At the moment, the biggest factor on the mind of British sprinters is to be number one in Britain,"" the world 200m and 400m record holder told Five Live.""The only time you see British sprinters getting upset or riled is when there is a debate as to which one is better than the other,"" he claimed.And the American remains highly critical of aspects of British sprinting.Speaking at an elite coaches' conference in Birmingham, Johnson also argued that although there has been more investment in the sport in Britain, it had not necessarily reaped the rewards"
Radcliffe proves doubters wrong,"And a lot of people were wondering what would happen if Paula was forced to drop out of this race, as she did in the marathon and 10,000m in Athens.And if she lost, people would say her career was over.I was speaking to Paula in the lead-up to this race and she said that in many ways she was facing a no-win situation.If Paula's last experience of the year had been Athens, it would have been very difficult to look forward with any optimism.It was a strong field, with a number of the girls going into the race with expectations of winning.Now Paula will take part in the Run London 10km race in London at the end of the year, have a well-earned rest over Christmas and go into next year with a lot of optimism.Even if she'd lost this race, there would have been a lot of positives to take out of it.But that was never on the cards.She thought that if she won, people would say ""why couldn't she do that in Athens?"
Jones medals 'must go if guilty',"""If she is found guilty she should be stripped of all her medals and banned for two years,"" said Pound.World Anti-Doping Agency (WADA) chief Dick Pound says Marion Jones should be stripped of all her medals if found guilty of taking banned substances.Asked if there was a timescale as to what medals could be taken, Pound said: ""That is not an issue at all.""Jones, who won five medals at the 2000 Olympics, denies using drugs and says she will take legal action over Conte's allegations"
Radcliffe tackles marathon tasks,"Paula Radcliffe faces arguably the biggest test of her career in the New York City Marathon on Sunday.Richards also points out conditions in New York will be more conducive to a strong physical display from Radcliffe.And Richards and Yelling agree she could turn the trauma to her advantage, starting in New York.Radcliffe has never raced there before and will enter the unknown just 77 days after the Athens marathon.Radcliffe described her decision to enter the New York marathon as ""impulsive"" but she is certain to have a tick-list of personal goals.""Paula has got all those great runs in her history as well as the two upsets in Athens.""It's suggested after a major marathon you take a full month off and start building up again,"" said Yelling, herself a marathon runner.Radcliffe's best friend and fellow distance runner Liz Yelling revealed the 30-year-old is already aware she will be exposing herself to more public scrutiny in New York.For much of the watching media and public there can only be two possible outcomes in New York - win or lose.""She just thought, 'well, they can't think any worse of me now,'"" Yelling told BBC Sport.""You can't change history,"" warned Richards.Back under the spotlight of public scrutiny she will attempt to erase the double disappointment of the Athens Olympics, where she failed to finish the marathon and then the 10,000m.BBC Sport examines the challenges facing Radcliffe ahead of the big race.""There is an old adage, 'get straight back on the horse that threw you,'"" Richards told BBC Sport.And Yelling says: ""I think this will probably make Paula.""Her aims could be as simple as completing a race and making sure she is still enjoying running but Richards says she must avoid more emotional targets, such as redemption.Radcliffe concedes she will probably learn a lot from her bad experiences in Athens in time"
Gatlin and Hayes win Owen awards,"""It is such a great honour to win the Jesse Owens Award,"" said Gatlin.Established in 1981, the Jesse Owens Awards - named in honour of the late Olympic great who won four gold medals at the 1936 Berlin Games - are presented annually to the outstanding US male and female track and field performers.American Olympic stars Justin Gatlin and Joanna Hayes have been named the winners of the 2004 Jesse Owens Awards, USA Track & Field's (USATF) top honour.""It is one of the biggest honours in track and field and it is a great end to a great year. "
Radcliffe enjoys winning comeback,"Just Chepkemei and Radcliffe were left in contention as the race came into the final few miles.But it was Radcliffe who managed to dredge up a final sprint to see off Chepkemei in the closest finish in the race's history and in the process make a huge step in erasing the disappointment she suffered in Athens.  The Kenyan put in several bursts of speed to throw off Radcliffe but the Briton managed to hang in.Radcliffe decided only recently to run in the race and many had doubted whether she had sufficiently recovered from her Olympic ordeal just 11 weeks ago.""It's a good way to end the year,"" she said"
