headlines,text
Claxton hunting first major medal,"For the first time, Claxton has only been preparing for a campaign over the hurdles - which could explain her leap in form.Claxton has won the national 60m hurdles title for the past three years but has struggled to translate her domestic success to the international stage.British hurdler Sarah Claxton is confident she can win her first major medal at next month's European Indoor Championships in Madrid.Claxton will see if her new training regime pays dividends at the European Indoors which take place on 5-6 March.""I am quite confident,"" said Claxton"
O'Sullivan could run in Worlds,"The participation of O'Sullivan, currentily training at her base in Australia, would boost the Ireland team who won the bronze three years agio.O'Sullivan will also take part in the Bupa Great Ireland Run on 9 April in Dublin.O'Sullivan is at present preparing for the London marathon on 17 April"
Greene sets sights on world title,"I think when I was coming up I would say there was me and Ato (Boldon) in the young crowd,"" Greene said.But Greene believes he lost the race and his title in the semi-finals.""In my semi-final race, I should have won the race but I was conserving energy.Greene was also denied Olympic gold in the 4x100m men's relay when he could not catch Britain's Mark Lewis-Francis on the final leg.I lost because of the things I did,"" said Greene, who races in Birmingham on Friday.It was my mistake.""I believe if I was in the middle of the race I would have been able to react to people that came ahead of me.""""That's when Francis Obikwelu came up and I took third because I didn't know he was there.Maurice Greene aims to wipe out the pain of losing his Olympic 100m title in Athens by winning a fourth World Championship crown this summer.""I believe that's what put me in lane seven in the final and, while I was in lane seven, I couldn't feel anything in the race"
IAAF launches fight against drugs,"""I am very happy to see you all, members of the athletics family, respond positively to the IAAF call to sit together and discuss what more we can do in the fight against doping,"" said Diack.The two task forces will report back to the IAAF Council, at its April meeting in Qatar.""Nothing was decided to change things - it was more to have a forum of the stakeholders allowing them to express themselves,"" said an IAAF spokesman.The IAAF - athletics' world governing body - has met anti-doping officials, coaches and athletes to co-ordinate the fight against drugs in sport"
"Dibaba breaks 5,000m world record","Ethiopia's Tirunesh Dibaba set a new world record in winning the women's 5,000m at the Boston Indoor Games.The plan was to go with 500m to go no matter what, but when Bekele made the mistake that was it.Dibaba won in 14 minutes 32.93 seconds to erase the previous world indoor mark of 14:39.29 set by another Ethiopian, Berhane Adera, in Stuttgart last year.Ireland's Alistair Cragg won in 7:39.89 as Bekele battled to second in 7:41.42"
Isinbayeva claims new world best,"In the men's 60m, former Olympic 100m champion Maurice Greene could only finish second to Leonard Scott.It was the Russian's 12th world record of her career and came just a few days after she cleared 4.88m at the Norwich Union Grand Prix in Birmingham.It was Greene's second consecutive defeat at the hands of his fellow American, who also won in Birmingham last week"
O'Sullivan commits to Dublin race,"Carroll will be facing stiff competition from Australian Craig Mottram, winner in Dublin for the last two years.Mark Carroll, Irish record holder at 3km, 5km and 10km, will make his debut in the mass participation 10km race.The 35-year-old was beaten into fourth at last year's event, having won it a year earlier"
Hansen 'delays return until 2006',"Moore said Hansen may be able to return to sprinting and long jumping sooner, but there is no short-term prospect of her being involved again in her specialist event.Moore said he is confident Hansen can make it back to top-level competition, though it is unclear if that will be in time for the Commonwealth Games in Melbourne next March, when she will be 34.""There was a problem with the wound healing and it set back her rehabilitation by about two months, but that has been solved and we can push ahead now,"" he said.British triple jumper Ashia Hansen has ruled out a comeback this year after a setback in her recovery from a bad knee injury, according to reports"
Off-colour Gardener storms to win,"At the same meeting,  finished third in 7.27 seconds in a high-class women's 60m.Gardener clocked 6.56 seconds to equal the meeting record and finished well ahead of Germany's Marc Blume, who crossed the line in 6.67 secs.The world indoor champion said: ""I got to the airport and my stomach was upset and I was vomiting.Britain's Jason Gardener shook off an upset stomach to win the 60m at Sunday's Leipzig International meeting.Olympic bronze heptathlon medallist  made a low-key return to action at an indoor meeting in Birmingham.Promising 60m hurdler  clocked a new UK record of 7.98 seconds at a meeting in Norway.The event was won by European medal favourite Christine Arron of France while Belgium rival Kim Gevaert was second., who broke onto the international scene at the Olympic Games last season, set an indoor personal best of 16.50m in the triple jump at a meeting in Ghent.Germany's Alexander Kosenkow won the race in 21.07 secs with Dutchman Patrick van Balkom second in 21.58 secs"
Collins to compete in Birmingham,"Collins ran in Birmingham at the 2003 World Indoor Championships.Sydney Olympic 100m champion and world indoor record holder Maurice Greene and Athens Olympic 100m silver medallist Francis Obikwelu will also take part.""Jason Gardener and Mark Lewis-Francis are Olympic gold medallists now and I'm sure they'll be aiming to win in front of their home supporters.Collins was sixth in the Olympic final in Athens but is hoping for a better result at the World Championships in Finland this summer.World and Commonwealth 100m champion Kim Collins will compete in the 60m at the Norwich Union Grand Prix in Birmingham on 18 February"
Radcliffe yet to answer GB call,"British team member Hayley Yelling said the team would understand if Radcliffe opted out of the event.""It would be fantastic to have Paula in the team,"" said the European cross-country champion.""There is no question that Paula would be a huge asset to the GB team,"" said Zara Hyde Peters of UK Athletics.Radcliffe was world cross-country champion in 2001 and 2002 but missed last year's event because of injury.Paula Radcliffe has been granted extra time to decide whether to compete in the World Cross-Country Championships"
Edwards tips Idowu for Euro gold,"World outdoor triple jump record holder and BBC pundit Jonathan Edwards believes Phillips Idowu can take gold at the European Indoor Championships.Idowu landed 17.30m at the British trials in Sheffield last month to lead the world triple jump rankings.""It's all down to him, but if he jumps as well as he did in Sheffield he could win the gold medal,"" said Edwards.Edwards himself kept Idowu off top spot at the Manchester Games.The qualifying round of the men's triple jump in Madrid takes place on Friday with the final scheduled for Saturday"
Kenya lift Chepkemei's suspension,"Masai missed Kenya's world cross country trials because of an ankle problem but AK insisted it would take disciplinary action unless she could prove she was really injured.The Kenyan coaching team will now decide whether Chepkemei can be included in the team for this month's world cross country championships.Kenya's athletics body has reversed a ban on marathon runner Susan Chepkemei after she made an official apology.AK also dropped its harsh stance on three-time world cross country 4km champion Edith Masai.Chepkemei has given a reason for her absence,"" said AK chief Isaiah Kiplagat.""I will be disappointed if I am not given a chance to compete at the world cross country championships.""AK had insisted it was making an example of Chepkemei by banning her from competition until the end of 2005"
McIlroy aiming for Madrid title,"Lester is better known for his work with 400m runners Roger Black and Mark Richardson in the past but under his guidance McIlroy has secured five wins this indoor season.McIlroy now lives in Windsor and feels his career has been transformed by the no-nonsense leadership style of former Army sergeant Lester.He said: ""I've been much more focused this year about my career and having such a good team around me has been very important.""I believe after my wins abroad and in our trial race in Sheffield, I can run my race from the front, back or middle,"" said McIlroy.Northern Ireland man James McIlroy is confident he can win his first major title at this weekend's Spar European Indoor Championships in Madrid.The rest of my time has seen me just concentrating on rebuilding my career.""""That ambition has meant that I've had only two nights out since last August.New coach Tony Lester has helped get McIlroy's career back on track.""That was my last decent year,"" said McIlroy, who temporarily retired last August before returning to the sport under Lester's shrewd guidance"
UK Athletics agrees new kit deal,"UK Athletics has agreed a new deal with adidas to supply Great Britain squads of all ages with their kit for the next four years.This week, UK Athletics also agreed a four-year deal with energy drink company, Red Bull, who will be supplying the product to athletics at major domestic meetings and in high performance centres.UK Athletics chief David Moorcroft said: ""The Athens experience can now be extended to more major championships"
Verdict delay for Greek sprinters,"Greek athletics' governing body has postponed by two weeks the judgement on sprinters Costas Kenteris and Katerina Thanou for missing doping tests.The IAAF said the sprinters had failed to provide samples for tests in Tel Aviv, Chicago and Athens and ordered Greek athletic's governing body, Segas, to hold a disciplinary inquiry.""I am confident and optimistic,"" Thanou had said at the time.The athletes, who spectacularly withdrew from the Athens Olympics, have been suspended by the International Association of Athletics Federations (IAAF) for missing the three tests.The pair are facing lengthy bans for the missed tests, including one on the eve of last year's Athens Olympics"
Call for Kenteris to be cleared,"Kostas Kenteris' lawyer has called for the doping charges against the Greek sprinter to be dropped.Kenteris and compatriot Katerina Thanou were given provisional suspensions in December for failing to take drugs tests before the Athens Olympics.Kenteris and Thanou withdrew from the Athens Olympics last August after missing drugs tests on the eve of the opening ceremony.The lawyer added that he has proof the authorities ""knew"" Kenteris was in Germany at the time he was alleged to have missed a test in Chicago.Gregory Ioannidis has submitted new evidence to a Greek athletics tribunal which he claims proves the former Olympic champion has no case to answer"
Merritt close to indoor 400m mark,"Kenyan Bernard Lagat missed out on the world record by 1.45secs as he ran the third quickest indoor mile ever to beat Canada's Nate Brannen by almost 10secs.The Olympic silver medallist's time of three minutes 49.89secs was inferior only to the 1997 world record of Moroccan Hicham El Guerrouj and former world record holder Eamonn Coghlan of Ireland's 3:49.78.World indoor 60m hurdles champion  also won, improving his season-leading time to 7.51secs.Only Michael Johnson has gone quicker, setting the world record of 44.63secs in 1995 and running 44.66secs in 1996.Olympic 200m gold medallist  of Jamaica ran the fastest women's 60m in the world this year as she equalled her personal best of 7.09secs"
London hope over Chepkemei,London Marathon organisers are hoping that banned athlete Susan Chepkemei will still take part in this year's race on 17 April.Chepkemei however took part and finished third in last Sunday's world best 10K race in Puerto Rico.The 29-year-old has finished second to Paula Radcliffe in the 2002 and 2003 London races as well as in November's New York City marathon
Edwards tips Idowu for Euro gold,"World outdoor triple jump record holder and BBC pundit Jonathan Edwards believes Phillips Idowu can take gold at the European Indoor Championships.Idowu landed 17.30m at the British trials in Sheffield last month to lead the world triple jump rankings.""It's all down to him, but if he jumps as well as he did in Sheffield he could win the gold medal,"" said Edwards.Edwards himself kept Idowu off top spot at the Manchester Games.The qualifying round of the men's triple jump in Madrid takes place on Friday with the final scheduled for Saturday"
Chepkemei hit by big ban,"Athletics Kenya (AK) issued the ban after Chepkemei failed to turn up for a cross country training camp in Embu.Global Sports Communications, Chepkemei's management company, said she had wanted to run in the World Cross Country Championships in March.KA has also threatened three-time women's short-course champion Edith Masai with a similar ban if reports that she feigned injury to avoid running at the cross country world championships are true.But the ban will prevent the two-time world half-marathon silver medallist from challenging Radcliffe at this year's London event in April.Kenya's athletics body has suspended two-time London Marathon runner-up Susan Chepkemei from all competition until the end of the year.""We have banned her from all local and international competitions,"" said AK chief Isaiah Kiplagat"
Holmes secures comeback victory,"I was nervous about whether I would actually be able to get round.""It was all about winning in front of my home crowd.Holmes hit the front just before the bell in front of a sell-out crowd in Glasgow and cruised to victory in a time of four minutes 14.74 seconds.""It was nice to get that out of the way.The Olympic 800m and 1500m champion's time was inside the qualifying mark for the European Indoor Championships in Madrid in March.Britain's Kelly Holmes marked her first appearance on home soil since winning double Olympic gold with 1500m victory at the Norwich Union International"
Greek pair attend drugs hearing,"Yiannis Papadoyiannakis, who was head of the Greek Olympic team at the Athens Games last year, also testified at the tribunal, along with other Greek sports officials and athletes.The five-member tribunal, assembled by the Hellenic Association of Amateur Athletics, is also examining allegations that Kenteris and Thanou avoided tests in Tel Aviv and Chicago before the Games.They were given provisional suspensions by athletics' ruling body the IAAF in December for failing to take drugs tests before the Athens Olympics.Tzekos was also banned for two years by the IAAF.Greek sprinters Kostas Kenteris and Katerina Thanou have appeared before an independent tribunal which will decide if their bans should stand.All three, who have repeatedly denied the allegations, have also been charged by a Greek prosecutor and face trial for doping-related charges.""There is also evidence that proves the fact that my client has been persecuted.""But Kenteris' lawyer Gregory Ioannidis told BBC Sport earlier this week he was confident the sprinters would be cleared of the charges of failing to give information on their location and refusing to submit to testing.""I believe the tribunal will reach a decision that will uphold the standing of the institution,"" said Papadoyiannakis"
Chepkemei joins Edinburgh line-up,"Susan Chepkemei has decided she is fit enough to run in next month's Great Edinburgh International Cross Country.Recently-crowned European cross country champion Briton Hayley Yelling also competes in Edinburgh on 15 January, as does in-form Scot Kathy Butler.Chepkemei, who won the six kilometre event three years ago when it was staged in Newcastle, endured an epic battle with Radcliffe in the Big Apple until the Briton outsprinted her in the final 400m"
El Guerrouj targets cross country,"Double Olympic champion Hicham El Guerrouj is set to make a rare appearance at the World Cross Country Championships in France.""I haven't quite decided what events I will compete in prior to London but the World Cross Country is an event which is also special to me and is a definite possibility,"" said the two-time champion.El Guerrouj could meet Bekele in March as the Ethiopian is the defending world cross country champion over both the long and short courses.- Britain's Paula Radcliffe has also not ruled out competing in the World Cross Country Championships.But the Moroccan, who has not raced over cross country for 15 years, will not decide until two weeks before the event which starts on 19 March.And he is aiming to break 10,000m Olympic champion Kenenisa Bekele's 5,000m and 10,000m world records"
Collins appeals against drugs ban,Sprinter Michelle Collins has lodged an appeal against her eight-year doping ban with the North American Court of Arbitration for Sport (CAS).The San Francisco-based Balco laboratory is at the centre of the scandal which has rocked the sport.Collins was suspended by the US Anti-Doping Agency based on patterns observed in her blood and urine tests as well as evidence in the Balco investigation.The 33-year-old received the ban last month as a result of her connection to the federal inquiry into the Balco doping scandal
Holmes feted with further honour,"Double Olympic champion Kelly Holmes has been voted European Athletics (EAA) woman athlete of 2004 in the governing body's annual poll.Her gutsy victory in the 800m also earned her the International Association of Athletics Federations' award for the best women's performance in the world for 2004.And she scooped two awards at the British Athletics Writers' Association annual dinner in October.The Briton, made a dame in the New Year Honours List for taking 800m and 1,500m gold, won vital votes from the public, press and EAA member federations"
Campbell to extend sprint career,"""To go to Athens and finally get the gold I've been trying to get for 24 years was a big relief,"" said Campbell.Campbell, who won Olympic 4x100m relay gold, had been unsure about his future.Campbell was part of the British quartet who shocked the Americans to win relay gold in Athens in August.The 31-year-old, who won Olympic 200m silver in Sydney in 2000, said during the Games that a hamstring injury had stopped him from running at his best.""I've started back and I'm thoroughly enjoying it.He was criticised at the time by former Olympic champion Michael Johnson, who cast doubt on Campbell's injury claims.Campbell set his 100m personal best of 10.04secs when he won the European title in Budapest in 1998"
Isinbayeva heads for Birmingham,"Olympic pole vault champion Yelena Isinbayeva has confirmed she will take part in the 2005 Norwich Union Grand Prix in Birmingham on 18 February.Isinbayeva, 22, has set 10 world records in the pole vault, three of which have come on British soil.The pair had a thrilling battle in Athens which ended with Isinbayeva finally jumping a world record of 4.91m to claim the gold medal.I always seem to break records there,"" said Isinbayeva"
2004: An Irish Athletics Year,"At the start of the year, several Northern Ireland athletes had genuine hopes of qualifying for the Games but come August, an out-of-form and injured Paul Brizzel was the lone standard bearer for the province.Sonia O'Sullivan's Olympic farewell apart, there was little to stir the emotions of Irish athletics watchers.Once the track and field action began in Athens, a familiar pattern of underachievement emerged although Alistair Cragg's performance in being the only athlete from a European nation to qualify for the 5,000m final did offer hope for the future.But come late August, a few hot days in the magnificent stadium in Athens told us of the true strength of Irish athletics - or to be more accurate, the lack of it.At least Sonia managed to make it to Athens.Amazingly, she was back in action a couple of weeks later when beating a world-class field at the Flora Lite 5K road race in London and while her major championship days may be over, it's unlikely that we have seen the last of her in competition.As it happened, she went out the back door early in the final although there was nothing undignified about the way that she insisted on finishing the race over a minute behind winner Meseret Defar.800m hope McIlroy never got near his best during the summer and a fourth place in the British trials effectively ended his hopes of making the plane.The injury-plagued Turnbull gamely travelled round Europe in search of the 1500m qualifying mark but 3:39 was the best he could achieve, after missing several months training during the previous winter.2004 won't be remembered as one of Irish athletics' great years.Less than a week before the Olympics, the sport was rocked by news that 10,000m hope Cathal Lombard had tested for the banned substance EPO.James McIlroy, Gareth Turnbull, Zoe Brown and Paul McKee all had to be content with watching the Athens action on their television screens"
Sprinter Walker quits athletics,"""I had intended to race but I'm running like a goon,"" said Walker.Walker had hoped to compete in the New Year Sprint which is staged at Musselburgh Racecourse near Edinburgh on Tuesday and Wednesday.He told the Herald newspaper: ""I'm not in great shape, after missing about a month of training.Former European 200m champion Dougie Walker is to retire from athletics after a series of six operations left him struggling for fitness"
Bekele sets sights on world mark,"Olympic 10,000m champion Kenenisa Bekele is determined to add the world indoor two mile record at February's Norwich Union Grand Prix in Birmingham.And Bekele is no stranger to overhauling world marks at the National Indoor Arena.The Ethiopian broke the world indoor 5,000m record on his debut at the meeting last year.""And aiming for the two mile world record in Birmingham is the next of those targets.""Compatriots Mulugeta Wondimu, Abiyote Abate and Markos Geneti, the world indoor bronze medallist over 3000m, will race against Bekele on 18 February"
Greek sprinters suspended by IAAF,"""There will be a final right of appeal from the decision of the Greek Federation to the Court of Arbitration for Sport,"" the IAAF said.Greek sprinters Kostas Kenteris and Katerina Thanou have been suspended after failing to take drugs tests before the Athens Olympics.Wednesday's statement said the Greek Federation (SEGAS) would convene a disciplinary hearing for the trio to determine whether there had been doping violations.Kenteris, the 2000 Olympic 200m champion, and Thanou, the women's 100m silver medallist from the same Games in Sydney, also face a criminal hearing in Greece over the missed tests.They face two-year bans if found guilty by the Greek Athletics Federation.Athletics' ruling body the IAAF said explanations from the pair and their former coach as to why they missed the tests were ""unacceptable"""
Athens memories soar above lows,"And it was a bit of a rarity for me too because I genuinely did not have an inkling how the race was going to pan out.Dropping out of the marathon was the right thing to do but starting in the 10,000m five days later was not wise.It was such good fun to commentate on her 1500m and it was nice to be able to be part of her Athens story.One of my favourite Olympic moments was Kelly's success in the 800m.Winning that race was the key to her success because if she won that then the 1500m would be a bit of a formality.So to have an Australian come up and deliver such a surprise was something special.The victory for the British men's 4x100m relay team was a bit of a surprise but a great climax to the Games.That was her heart and not her head reacting.He was the first man since for 80 years to win both the 1500m and 5,000m titles.And one of the positive things to come out of Balco is people are starting to blow the whistle.It was also a real delight for all athletics fans because, to use one of my favourite words, Paula showed real ""bouncebackability"".The thing is if we don't have athletes getting into the finals at junior level then it really doesn't look good for the Beijing Olympics and beyond.What happened to Paula in Athens this year is the obvious low on a personal level and for the expectations of the nation as well.The only individual men's finalist on the track was Michael East in the 1500m.Dani Barnes came fourth in the 1500m and she was the highest finisher for Team GB.Paula had a lot of little things going wrong in her preparation and on the day.The lads had run poorly in the individual sprints so maybe they did lift their game when they knew something was really at stake.Well, it's goodbye to another Olympic year and as usual there were plenty of highs and lows in Athens.And that's where things begin to look even gloomier for British athletics as we did not win any medals at the world junior championships in Italy"
